{
  "schemaVersion": "v1",
  "cursor": "42",
  "event": {
    "specVersion": "1.0",
    "eventId": "33333333-3333-4333-8333-333333333333",
    "eventType": "order.status.changed",
    "occurredAt": "2026-08-22T10:00:00Z",
    "producer": "business-api",
    "aggregateId": "11111111-1111-4111-8111-111111111111",
    "aggregateVersion": 2,
    "correlationId": "44444444-4444-4444-8444-444444444444",
    "causationId": "55555555-5555-4555-8555-555555555555",
    "traceId": "0123456789abcdef0123456789abcdef",
    "payload": {"orderId": "11111111-1111-4111-8111-111111111111", "status": "CONFIRMED"}
  },
  "replay": false,
  "stale": false,
  "staleReason": null
}
